,date,Open,High,Low,Close,Adj Close,Volume,Pct_change,username,tweet,tweet_lc,tweet_without_stopwords,ts_polarity,subjetividade,analise,tokenized_text,text_lemmatized,media_pol,media_sub,ts_volume
284,2020-11-24,107378.0,109956.0,107361.0,109786.0,109786.0,11934800,0.022415928626640325,minsaude,"Você conhece o Banco de Preços em Saúde (BPS)? Ele permite a pesquisa e comparação de preços de medicamentos e produtos para a saúde em âmbito nacional, e ajuda até em investigações de sobrepreços em compras governamentais. Saiba mais:  ","você conhece o banco de preços em saúde (bps)? ele permite a pesquisa e comparação de preços de medicamentos e produtos para a saúde em âmbito nacional, e ajuda até em investigações de sobrepreços em compras governamentais. saiba mais:  "," conhece  banco  preços  saúde (bps)?  permite  pesquisa  comparação  preços  medicamentos  produtos   saúde  âmbito nacional,  ajuda   investigações  sobrepreços  compras governamentais. saiba :  ",0.0,0.0,Neutro,"['conhece', 'banco', 'preços', 'saúde', '(', 'bps', ')', '?', 'permite', 'pesquisa', 'comparação', 'preços', 'medicamentos', 'produtos', 'saúde', 'âmbito', 'nacional', ',', 'ajuda', 'investigações', 'sobrepreços', 'compras', 'governamentais', '.', 'saiba', ':']","['conhece', 'banco', 'preços', 'saúde', '(', 'bps', ')', '?', 'permite', 'pesquisa', 'comparação', 'preços', 'medicamentos', 'produtos', 'saúde', 'âmbito', 'nacional', ',', 'ajuda', 'investigações', 'sobrepreços', 'compras', 'governamentais', '.', 'saiba', ':']",0.0,0.0333333333333333,6.0
285,2020-11-24,107378.0,109956.0,107361.0,109786.0,109786.0,11934800,0.022415928626640325,minsaude,"Atenção, profissionais de saúde, ensino e pesquisa, técnicos das secretarias de saúde e estudantes. “Os desafios do processo de eliminação da malária nas Américas” é o tema da webinar que o  promove hoje, às 15h. O evento pode ser acompanhado em    ","atenção, profissionais de saúde, ensino e pesquisa, técnicos das secretarias de saúde e estudantes. “os desafios do processo de eliminação da malária nas américas” é o tema da webinar que o  promove hoje, às 15h. o evento pode ser acompanhado em    ","atenção, profissionais  saúde, ensino  pesquisa, técnicos  secretarias  saúde  estudantes. “ desafios  processo  eliminação  malária  américas”   tema  webinar    promove hoje,  15h.  evento pode ser acompanhado     ",0.0,0.1,Neutro,"['atenção', ',', 'profissionais', 'saúde', ',', 'ensino', 'pesquisa', ',', 'técnicos', 'secretarias', 'saúde', 'estudantes', '.', '“', 'desafios', 'processo', 'eliminação', 'malária', 'américas', '”', 'tema', 'webinar', 'promove', 'hoje', ',', '15h', '.', 'evento', 'pode', 'ser', 'acompanhado']","['atenção', ',', 'profissionais', 'saúde', ',', 'ensino', 'pesquisa', ',', 'técnicos', 'secretarias', 'saúde', 'estudantes', '.', '“', 'desafios', 'processo', 'eliminação', 'malária', 'américas', '”', 'tema', 'webinar', 'promove', 'hoje', ',', '15h', '.', 'evento', 'pode', 'ser', 'acompanhado']",0.0,0.0333333333333333,6.0
286,2020-11-25,109786.0,110596.0,109315.0,110133.0,110133.0,8564700,0.003160694441914247,,,,,,,,,,,,
287,2020-11-26,110133.0,110245.0,109418.0,110227.0,110227.0,6166800,0.0008535134791569643,conassoficial,"No dia 27/11, 14h (horário de Brasília), a _oficial e o  apresentarão informações das bases de dados já disponíveis para pesquisa de utilização de medicamentos, farmacovigilância, regulação de preços, registro sanitário, entre outros.  ","no dia 27/11, 14h (horário de brasília), a _oficial e o  apresentarão informações das bases de dados já disponíveis para pesquisa de utilização de medicamentos, farmacovigilância, regulação de preços, registro sanitário, entre outros.  "," dia 27/11, 14h (horário  brasília),  _oficial    apresentarão informações  bases  dados  disponíveis  pesquisa  utilização  medicamentos, farmacovigilância, regulação  preços, registro sanitário,  outros.  ",0.2,0.2,Positivo,"['dia', '27/11', ',', '14h', '(', 'horário', 'brasília', ')', ',', '_oficial', 'apresentarão', 'informações', 'bases', 'dados', 'disponíveis', 'pesquisa', 'utilização', 'medicamentos', ',', 'farmacovigilância', ',', 'regulação', 'preços', ',', 'registro', 'sanitário', ',', 'outros', '.']","['dia', '27/11', ',', '14h', '(', 'horário', 'brasília', ')', ',', '_oficial', 'apresentarão', 'informações', 'base', 'dado', 'disponíveis', 'pesquisa', 'utilização', 'medicamentos', ',', 'farmacovigilância', ',', 'regulação', 'preços', ',', 'registro', 'sanitário', ',', 'outros', '.']",0.1,0.1,2.0
288,2020-11-26,110133.0,110245.0,109418.0,110227.0,110227.0,6166800,0.0008535134791569643,mqueiroga2,_santos _cientifico Reconhecer o mérito de pesquisadores como você é uma obrigação de uma sociedade científica. Valorizar pesquisa é reconhecer a ciência.,_santos _cientifico reconhecer o mérito de pesquisadores como você é uma obrigação de uma sociedade científica. valorizar pesquisa é reconhecer a ciência.,_santos _cientifico reconhecer  mérito  pesquisadores     obrigação   sociedade científica. valorizar pesquisa  reconhecer  ciência.,0.0,0.0,Neutro,"['_santos', '_cientifico', 'reconhecer', 'mérito', 'pesquisadores', 'obrigação', 'sociedade', 'científica', '.', 'valorizar', 'pesquisa', 'reconhecer', 'ciência', '.']","['_santos', '_cientifico', 'reconhecer', 'mérito', 'pesquisadores', 'obrigação', 'sociedade', 'científica', '.', 'valorizar', 'pesquisa', 'reconhecer', 'ciência', '.']",0.1,0.1,2.0
289,2020-11-27,110229.0,111603.0,110161.0,110575.0,110575.0,8790300,0.0031571212134957616,mqueiroga2,Pesquisa e ciência têm papel vital na luta contra o novo coronavírus. ⁦_cientifico⁩   ,pesquisa e ciência têm papel vital na luta contra o novo coronavírus. ⁦_cientifico⁩   ,pesquisa  ciência têm papel vital  luta contra  novo coronavírus. ⁦_cientifico⁩   ,0.1181818181818181,0.4272727272727273,Positivo,"['pesquisa', 'ciência', 'têm', 'papel', 'vital', 'luta', 'contra', 'novo', 'coronavírus', '.', '\u2066_cientifico\u2069']","['pesquisa', 'ciência', 'têm', 'papel', 'vital', 'luta', 'contra', 'novo', 'coronavírus', '.', '\u2066_cientifico\u2069']",0.1181818181818181,0.4272727272727273,1.0
290,2020-11-30,110598.0,110934.0,108829.0,108888.0,108888.0,19300000,-0.015256613158489696,,,,,,,,,,,,
291,2020-12-01,108897.0,111840.0,108897.0,111335.0,111335.0,11324800,0.022472632429652473,,,,,,,,,,,,
292,2020-12-02,111402.0,112315.0,110579.0,111814.0,111814.0,9814300,0.00430233080343112,conassoficial,"Para Frutuoso, é essencial fortalecer a pesquisa e garantir a vacina. O secretário-executivo do Conass mostrou a importância de se garantir que recursos extraordinários, reservados para Covid-19 em 2020, possam ser usados também em 2021.","para frutuoso, é essencial fortalecer a pesquisa e garantir a vacina. o secretário-executivo do conass mostrou a importância de se garantir que recursos extraordinários, reservados para covid-19 em 2020, possam ser usados também em 2021."," frutuoso,  essencial fortalecer  pesquisa  garantir  vacina.  secretário-executivo  conass mostrou  importância   garantir  recursos extraordinários, reservados  covid-19  2020, possam ser usados   2021.",0.1666666666666666,0.65,Positivo,"['frutuoso', ',', 'essencial', 'fortalecer', 'pesquisa', 'garantir', 'vacina', '.', 'secretário-executivo', 'conass', 'mostrou', 'importância', 'garantir', 'recursos', 'extraordinários', ',', 'reservados', 'covid-19', '2020', ',', 'possam', 'ser', 'usados', '2021', '.']","['frutuoso', ',', 'essencial', 'fortalecer', 'pesquisa', 'garantir', 'vacina', '.', 'secretário-executivo', 'conass', 'mostrou', 'importância', 'garantir', 'recursos', 'extraordinários', ',', 'reservados', 'covid-19', '2020', ',', 'possam', 'ser', 'usados', '2021', '.']",0.1666666666666666,0.65,1.0
293,2020-12-03,111874.0,113377.0,111874.0,112919.0,112919.0,11474200,0.009882483409948684,butantanoficial," 1 É isso mesmo, Cisso! Quando desenvolvemos uma pesquisa e uma vacina tão importantes, não pensamos em nada mais, muito menos em interesse político. Nosso objetivo é salvar vidas, unicamente. Pode confiar 🥰Servimos o Brasil há 120 anos! EquipeButantan CoronaVac"," 1 é isso mesmo, cisso! quando desenvolvemos uma pesquisa e uma vacina tão importantes, não pensamos em nada mais, muito menos em interesse político. nosso objetivo é salvar vidas, unicamente. pode confiar 🥰servimos o brasil há 120 anos! equipebutantan coronavac"," 1   , cisso!  desenvolvemos  pesquisa   vacina tão importantes,  pensamos  nada ,  menos  interesse político.  objetivo  salvar vidas, unicamente. pode confiar 🥰servimos  brasil  120 anos! equipebutantan coronavac",0.1,0.5800000000000001,Positivo,"['1', ',', 'cisso', '!', 'desenvolvemos', 'pesquisa', 'vacina', 'tão', 'importantes', ',', 'pensamos', 'nada', ',', 'menos', 'interesse', 'político', '.', 'objetivo', 'salvar', 'vidas', ',', 'unicamente', '.', 'pode', 'confiar', '🥰servimos', 'brasil', '120', 'anos', '!', 'equipebutantan', 'coronavac']","['1', ',', 'cisso', '!', 'desenvolvemos', 'pesquisa', 'vacina', 'tão', 'importantes', ',', 'pensamos', 'nada', ',', 'menos', 'interesse', 'político', '.', 'objetivo', 'salvar', 'vidas', ',', 'unicamente', '.', 'pode', 'confiar', '🥰servimos', 'brasil', '120', 'ano', '!', 'equipebutantan', 'coronavac']",0.1,0.5800000000000001,2.0
294,2020-12-03,111874.0,113377.0,111874.0,112919.0,112919.0,11474200,0.009882483409948684,butantanoficial,"  38 Quando desenvolvemos uma pesquisa e uma vacina tão importantes, não pensamos em nada mais, muito menos em interesse político. Nosso objetivo é salvar vidas, unicamente. Pode confiar. Servimos o Brasil há 120 anos. EquipeButantan coronavirus CoronaVac","  38 quando desenvolvemos uma pesquisa e uma vacina tão importantes, não pensamos em nada mais, muito menos em interesse político. nosso objetivo é salvar vidas, unicamente. pode confiar. servimos o brasil há 120 anos. equipebutantan coronavirus coronavac","  38  desenvolvemos  pesquisa   vacina tão importantes,  pensamos  nada ,  menos  interesse político.  objetivo  salvar vidas, unicamente. pode confiar. servimos  brasil  120 anos. equipebutantan coronavirus coronavac",0.1,0.5800000000000001,Positivo,"['38', 'desenvolvemos', 'pesquisa', 'vacina', 'tão', 'importantes', ',', 'pensamos', 'nada', ',', 'menos', 'interesse', 'político', '.', 'objetivo', 'salvar', 'vidas', ',', 'unicamente', '.', 'pode', 'confiar', '.', 'servimos', 'brasil', '120', 'anos', '.', 'equipebutantan', 'coronavirus', 'coronavac']","['38', 'desenvolvemos', 'pesquisa', 'vacina', 'tão', 'importantes', ',', 'pensamos', 'nada', ',', 'menos', 'interesse', 'político', '.', 'objetivo', 'salvar', 'vidas', ',', 'unicamente', '.', 'pode', 'confiar', '.', 'servimos', 'brasil', '120', 'ano', '.', 'equipebutantan', 'coronavirus', 'coronavac']",0.1,0.5800000000000001,2.0
295,2020-12-04,112294.0,113864.0,112294.0,113682.0,113682.0,8892900,0.006757055942755441,,,,,,,,,,,,
296,2020-12-07,113751.0,114531.0,112629.0,113625.0,113625.0,9633900,-0.0005013986383068936,agencia_fiocruz,Estudo mostra avanço na busca por terapia para prevenir a síndrome congênita do zika. Medicamento usado no tratamento da hepatite C impediu transmissão do vírus na gestação e evitou malformações em ensaios com macacos.    Fiocruz pesquisa Zika  ,estudo mostra avanço na busca por terapia para prevenir a síndrome congênita do zika. medicamento usado no tratamento da hepatite c impediu transmissão do vírus na gestação e evitou malformações em ensaios com macacos.    fiocruz pesquisa zika  ,estudo mostra avanço  busca  terapia  prevenir  síndrome congênita  zika. medicamento usado  tratamento  hepatite c impediu transmissão  vírus  gestação  evitou malformações  ensaios  macacos.    fiocruz pesquisa zika  ,0.0,0.0,Neutro,"['estudo', 'mostra', 'avanço', 'busca', 'terapia', 'prevenir', 'síndrome', 'congênita', 'zika', '.', 'medicamento', 'usado', 'tratamento', 'hepatite', 'c', 'impediu', 'transmissão', 'vírus', 'gestação', 'evitou', 'malformações', 'ensaios', 'macacos', '.', 'fiocruz', 'pesquisa', 'zika']","['estudo', 'mostra', 'avanço', 'busca', 'terapia', 'prevenir', 'síndrome', 'congênita', 'zika', '.', 'medicamento', 'usado', 'tratamento', 'hepatite', 'c', 'impediu', 'transmissão', 'vírus', 'gestação', 'evitou', 'malformações', 'ensaios', 'macacos', '.', 'fiocruz', 'pesquisa', 'zika']",0.0,0.0444444444444444,3.0
297,2020-12-07,113751.0,114531.0,112629.0,113625.0,113625.0,9633900,-0.0005013986383068936,minsaude,Pesquisa inédita encomendada pelo Ministério da Saúde aponta que prevalência da anemia reduziu pela metade nos últimos 13 anos. Também reduzimos a carência de vitamina A em crianças de até 5 anos. Veja mais detalhes:  ,pesquisa inédita encomendada pelo ministério da saúde aponta que prevalência da anemia reduziu pela metade nos últimos 13 anos. também reduzimos a carência de vitamina a em crianças de até 5 anos. veja mais detalhes:  ,pesquisa inédita encomendada  ministério  saúde aponta  prevalência  anemia reduziu  metade  últimos 13 anos.  reduzimos  carência  vitamina   crianças   5 anos. veja  detalhes:  ,0.0,0.0666666666666666,Neutro,"['pesquisa', 'inédita', 'encomendada', 'ministério', 'saúde', 'aponta', 'prevalência', 'anemia', 'reduziu', 'metade', 'últimos', '13', 'anos', '.', 'reduzimos', 'carência', 'vitamina', 'crianças', '5', 'anos', '.', 'veja', 'detalhes', ':']","['pesquisa', 'inédita', 'encomendada', 'ministério', 'saúde', 'aponta', 'prevalência', 'anemia', 'reduziu', 'metade', 'últimos', '13', 'ano', '.', 'reduzimos', 'carência', 'vitamina', 'crianças', '5', 'ano', '.', 'veja', 'detalhes', ':']",0.0,0.0444444444444444,3.0
298,2020-12-08,113590.0,114381.0,112820.0,113571.0,113571.0,8810900,-0.00047524752475247567,agencia_fiocruz,Pesquisa liderada pelo Instituto Oswaldo Cruz /  e _oficial aponta infecção persistente do zika na placenta.    pesquisa Zika  ,pesquisa liderada pelo instituto oswaldo cruz /  e _oficial aponta infecção persistente do zika na placenta.    pesquisa zika  ,pesquisa liderada  instituto oswaldo cruz /   _oficial aponta infecção persistente  zika  placenta.    pesquisa zika  ,0.0,0.0,Neutro,"['pesquisa', 'liderada', 'instituto', 'oswaldo', 'cruz', '/', '_oficial', 'aponta', 'infecção', 'persistente', 'zika', 'placenta', '.', 'pesquisa', 'zika']","['pesquisa', 'liderada', 'instituto', 'oswaldo', 'cruz', '/', '_oficial', 'aponta', 'infecção', 'persistente', 'zika', 'placenta', '.', 'pesquisa', 'zika']",0.0,0.0,2.0
299,2020-12-08,113590.0,114381.0,112820.0,113571.0,113571.0,8810900,-0.00047524752475247567,conassoficial,Pesquisa chama atenção para as condições de trabalho e saúde dos agentes comunitários   via ,pesquisa chama atenção para as condições de trabalho e saúde dos agentes comunitários   via ,pesquisa chama atenção   condições  trabalho  saúde  agentes comunitários   via ,0.0,0.0,Neutro,"['pesquisa', 'chama', 'atenção', 'condições', 'trabalho', 'saúde', 'agentes', 'comunitários', 'via']","['pesquisa', 'chama', 'atenção', 'condições', 'trabalho', 'saúde', 'agentes', 'comunitários', 'via']",0.0,0.0,2.0
300,2020-12-09,113799.0,114020.0,112567.0,112722.0,112722.0,8431100,-0.007475499907546812,conassoficial,Pesquisa vai avaliar a percepção de jornalistas brasileiros sobre seu trabalho durante a pandemia   via ,pesquisa vai avaliar a percepção de jornalistas brasileiros sobre seu trabalho durante a pandemia   via ,pesquisa vai avaliar  percepção  jornalistas brasileiros sobre  trabalho durante  pandemia   via ,0.0,0.0,Neutro,"['pesquisa', 'vai', 'avaliar', 'percepção', 'jornalistas', 'brasileiros', 'sobre', 'trabalho', 'durante', 'pandemia', 'via']","['pesquisa', 'vai', 'avaliar', 'percepção', 'jornalistas', 'brasileiros', 'sobre', 'trabalho', 'durante', 'pandemia', 'via']",0.0,0.0,1.0
301,2020-12-10,113002.0,115262.0,112732.0,114992.0,114992.0,11803600,0.02013803871471409,butantanoficial,"13Kobayashi 1 Olá, bom dia. Quando desenvolvemos uma pesquisa e uma vacina tão importante, não pensamos em nada mais, muito menos em interesse político. Nosso objetivo é salvar vidas, unicamente. Pode confiar. Servimos o Brasil há 120 anos. 👊💚EquipeButantan VacinaDoButantan LutaPelaVida","13kobayashi 1 olá, bom dia. quando desenvolvemos uma pesquisa e uma vacina tão importante, não pensamos em nada mais, muito menos em interesse político. nosso objetivo é salvar vidas, unicamente. pode confiar. servimos o brasil há 120 anos. 👊💚equipebutantan vacinadobutantan lutapelavida","13kobayashi 1 olá, bom dia.  desenvolvemos  pesquisa   vacina tão importante,  pensamos  nada ,  menos  interesse político.  objetivo  salvar vidas, unicamente. pode confiar. servimos  brasil  120 anos. 👊💚equipebutantan vacinadobutantan lutapelavida",0.1999999999999999,0.5833333333333334,Positivo,"['13kobayashi', '1', 'olá', ',', 'bom', 'dia', '.', 'desenvolvemos', 'pesquisa', 'vacina', 'tão', 'importante', ',', 'pensamos', 'nada', ',', 'menos', 'interesse', 'político', '.', 'objetivo', 'salvar', 'vidas', ',', 'unicamente', '.', 'pode', 'confiar', '.', 'servimos', 'brasil', '120', 'anos', '.', '👊💚equipebutantan', 'vacinadobutantan', 'lutapelavida']","['13kobayashi', '1', 'olá', ',', 'bom', 'dia', '.', 'desenvolvemos', 'pesquisa', 'vacina', 'tão', 'importante', ',', 'pensamos', 'nada', ',', 'menos', 'interesse', 'político', '.', 'objetivo', 'salvar', 'vidas', ',', 'unicamente', '.', 'pode', 'confiar', '.', 'servimos', 'brasil', '120', 'ano', '.', '👊💚equipebutantan', 'vacinadobutantan', 'lutapelavida']",0.1833333333333333,0.4166666666666667,2.0
302,2020-12-10,113002.0,115262.0,112732.0,114992.0,114992.0,11803600,0.02013803871471409,agencia_fiocruz,Instituto Nacional de Controle de Qualidade em Saúde /  colabora em pesquisa com uso do zebrafish para testar segurança de vacinas contra a Covid-19.    zebrafish pesquisaemsaúde COVID19 Fiocruz incqs  ,instituto nacional de controle de qualidade em saúde /  colabora em pesquisa com uso do zebrafish para testar segurança de vacinas contra a covid-19.    zebrafish pesquisaemsaúde covid19 fiocruz incqs  ,instituto nacional  controle  qualidade  saúde /  colabora  pesquisa  uso  zebrafish  testar segurança  vacinas contra  covid-19.    zebrafish pesquisaemsaúde covid19 fiocruz incqs  ,0.0,0.0,Neutro,"['instituto', 'nacional', 'controle', 'qualidade', 'saúde', '/', 'colabora', 'pesquisa', 'uso', 'zebrafish', 'testar', 'segurança', 'vacinas', 'contra', 'covid-19', '.', 'zebrafish', 'pesquisaemsaúde', 'covid19', 'fiocruz', 'incqs']","['instituto', 'nacional', 'controle', 'qualidade', 'saúde', '/', 'colabora', 'pesquisa', 'uso', 'zebrafish', 'testar', 'segurança', 'vacinas', 'contra', 'covid-19', '.', 'zebrafish', 'pesquisaemsaúde', 'covid19', 'fiocruz', 'incqs']",0.0,0.0,1.0
303,2020-12-10,113002.0,115262.0,112732.0,114992.0,114992.0,11803600,0.02013803871471409,butantanoficial,"10 1 É baseada na pesquisa, na qualidade e no histórico para dar respostas rápidas à sociedade. Há 120 anos nosso trabalho é esse: salvar vidas. Pode confiar. 💪👊 EquipeButantan VacinaDoButantan EuConfio  InstitutoButantan Butantan120Anos","10 1 é baseada na pesquisa, na qualidade e no histórico para dar respostas rápidas à sociedade. há 120 anos nosso trabalho é esse: salvar vidas. pode confiar. 💪👊 equipebutantan vacinadobutantan euconfio  institutobutantan butantan120anos","10 1  baseada  pesquisa,  qualidade   histórico  dar respostas rápidas  sociedade.  120 anos  trabalho  : salvar vidas. pode confiar. 💪👊 equipebutantan vacinadobutantan euconfio  institutobutantan butantan120anos",0.1666666666666666,0.25,Positivo,"['10', '1', 'baseada', 'pesquisa', ',', 'qualidade', 'histórico', 'dar', 'respostas', 'rápidas', 'sociedade', '.', '120', 'anos', 'trabalho', ':', 'salvar', 'vidas', '.', 'pode', 'confiar', '.', '💪👊', 'equipebutantan', 'vacinadobutantan', 'euconfio', 'institutobutantan', 'butantan120anos']","['10', '1', 'baseada', 'pesquisa', ',', 'qualidade', 'histórico', 'dar', 'respostas', 'rápidas', 'sociedade', '.', '120', 'ano', 'trabalho', ':', 'salvar', 'vidas', '.', 'pode', 'confiar', '.', '💪👊', 'equipebutantan', 'vacinadobutantan', 'euconfio', 'institutobutantan', 'butantan120anos']",0.1833333333333333,0.4166666666666667,2.0
304,2020-12-11,115128.0,115527.0,113949.0,115323.0,115323.0,8372300,0.002878461110338071,,,,,,,,,,,,
305,2020-12-14,115137.0,115740.0,114431.0,114975.0,114975.0,8190900,-0.0030176114044899727,,,,,,,,,,,,
306,2020-12-15,114613.0,116390.0,114613.0,116146.0,116146.0,8195100,0.010184822787562497,butantanoficial," Deneolia, quando desenvolvemos uma pesquisa e uma vacina tão importantes, não pensamos em nada mais, muito menos em interesse político. Nosso objetivo é salvar vidas, unicamente. Pode confiar. Servimos o Brasil há 120 anos. EquipeButantan"," deneolia, quando desenvolvemos uma pesquisa e uma vacina tão importantes, não pensamos em nada mais, muito menos em interesse político. nosso objetivo é salvar vidas, unicamente. pode confiar. servimos o brasil há 120 anos. equipebutantan"," deneolia,  desenvolvemos  pesquisa   vacina tão importantes,  pensamos  nada ,  menos  interesse político.  objetivo  salvar vidas, unicamente. pode confiar. servimos  brasil  120 anos. equipebutantan",0.1,0.5800000000000001,Positivo,"['deneolia', ',', 'desenvolvemos', 'pesquisa', 'vacina', 'tão', 'importantes', ',', 'pensamos', 'nada', ',', 'menos', 'interesse', 'político', '.', 'objetivo', 'salvar', 'vidas', ',', 'unicamente', '.', 'pode', 'confiar', '.', 'servimos', 'brasil', '120', 'anos', '.', 'equipebutantan']","['deneolia', ',', 'desenvolvemos', 'pesquisa', 'vacina', 'tão', 'importantes', ',', 'pensamos', 'nada', ',', 'menos', 'interesse', 'político', '.', 'objetivo', 'salvar', 'vidas', ',', 'unicamente', '.', 'pode', 'confiar', '.', 'servimos', 'brasil', '120', 'ano', '.', 'equipebutantan']",0.1165054563492063,0.4160019841269841,14.0
307,2020-12-15,114613.0,116390.0,114613.0,116146.0,116146.0,8195100,0.010184822787562497,butantanoficial,"47333003 Obrigado, Francisco! Credibilidade é algo que se conquista com o tempo e com resultados. Com estudos, planejamento e muita pesquisa. Há 120 anos cuidamos de salvar vidas, desenvolvendo vacinas que hoje estão na rotina de todos os brasileiros. EquipeButantan","47333003 obrigado, francisco! credibilidade é algo que se conquista com o tempo e com resultados. com estudos, planejamento e muita pesquisa. há 120 anos cuidamos de salvar vidas, desenvolvendo vacinas que hoje estão na rotina de todos os brasileiros. equipebutantan","47333003 obrigado, francisco! credibilidade  algo   conquista   tempo   resultados.  estudos, planejamento  muita pesquisa.  120 anos cuidamos  salvar vidas, desenvolvendo vacinas  hoje   rotina  todos  brasileiros. equipebutantan",0.0,0.0,Neutro,"['47333003', 'obrigado', ',', 'francisco', '!', 'credibilidade', 'algo', 'conquista', 'tempo', 'resultados', '.', 'estudos', ',', 'planejamento', 'muita', 'pesquisa', '.', '120', 'anos', 'cuidamos', 'salvar', 'vidas', ',', 'desenvolvendo', 'vacinas', 'hoje', 'rotina', 'todos', 'brasileiros', '.', 'equipebutantan']","['47333003', 'obrigado', ',', 'francisco', '!', 'credibilidade', 'algo', 'conquista', 'tempo', 'resultados', '.', 'estudos', ',', 'planejamento', 'muita', 'pesquisa', '.', '120', 'ano', 'cuidamos', 'salvar', 'vidas', ',', 'desenvolvendo', 'vacinas', 'hoje', 'rotina', 'todos', 'brasileiros', '.', 'equipebutantan']",0.1165054563492063,0.4160019841269841,14.0
308,2020-12-15,114613.0,116390.0,114613.0,116146.0,116146.0,8195100,0.010184822787562497,butantanoficial,"28henriques muita pesquisa. Nosso trabalho é reconhecido por diversos especialistas, dentro e fora do Brasil. Quem tem algum preconceito contra os resultados da vacina, precisa conhecer quem produziu. EquipeButantan VacinaDoButantan LutaPelaVida Coronavac Covid19","28henriques muita pesquisa. nosso trabalho é reconhecido por diversos especialistas, dentro e fora do brasil. quem tem algum preconceito contra os resultados da vacina, precisa conhecer quem produziu. equipebutantan vacinadobutantan lutapelavida coronavac covid19","28henriques muita pesquisa.  trabalho  reconhecido  diversos especialistas, dentro    brasil.   algum preconceito contra  resultados  vacina, precisa conhecer  produziu. equipebutantan vacinadobutantan lutapelavida coronavac covid19",0.0,0.0,Neutro,"['28henriques', 'muita', 'pesquisa', '.', 'trabalho', 'reconhecido', 'diversos', 'especialistas', ',', 'dentro', 'brasil', '.', 'algum', 'preconceito', 'contra', 'resultados', 'vacina', ',', 'precisa', 'conhecer', 'produziu', '.', 'equipebutantan', 'vacinadobutantan', 'lutapelavida', 'coronavac', 'covid19']","['28henriques', 'muita', 'pesquisa', '.', 'trabalho', 'reconhecido', 'diversos', 'especialistas', ',', 'dentro', 'brasil', '.', 'algum', 'preconceito', 'contra', 'resultados', 'vacina', ',', 'precisa', 'conhecer', 'produziu', '.', 'equipebutantan', 'vacinadobutantan', 'lutapelavida', 'coronavac', 'covid19']",0.1165054563492063,0.4160019841269841,14.0
