,date,Open,High,Low,Close,Adj Close,Volume,Pct_change,username,tweet,tweet_lc,tweet_without_stopwords,ts_polarity,subjetividade,analise,tokenized_text,text_lemmatized,media_pol,media_sub,ts_volume
612,2021-03-26,113750.0,115416.0,113305.0,114781.0,114781.0,8659500,0.009063736263736244,butantanoficial,"@natalierosa Obrigado pelo interesse, Natalie, mas ainda não estão sendo recrutados voluntários para o estudo clínico da Butanvac. A pesquisa sobre a nova vacina do Butantan contra Covid-19 ainda não foi autorizada pela Anvisa. Conte conosco nessa #LutaPelaVida! 😉 #EquipeButantan","@natalierosa obrigado pelo interesse, natalie, mas ainda não estão sendo recrutados voluntários para o estudo clínico da butanvac. a pesquisa sobre a nova vacina do butantan contra covid-19 ainda não foi autorizada pela anvisa. conte conosco nessa #lutapelavida! 😉 #equipebutantan","@natalierosa obrigado  interesse, natalie,  ainda   sendo recrutados voluntários   estudo clínico  butanvac.  pesquisa sobre  nova vacina  butantan contra covid-19 ainda   autorizada  anvisa. conte conosco nessa #lutapelavida! 😉 #equipebutantan",0.1704545454545454,0.4545454545454545,Positivo,"['@', 'natalierosa', 'obrigado', 'interesse', ',', 'natalie', ',', 'ainda', 'sendo', 'recrutados', 'voluntários', 'estudo', 'clínico', 'butanvac', '.', 'pesquisa', 'sobre', 'nova', 'vacina', 'butantan', 'contra', 'covid-19', 'ainda', 'autorizada', 'anvisa', '.', 'conte', 'conosco', 'nessa', '#', 'lutapelavida', '!', '😉', '#', 'equipebutantan']","['@', 'natalierosa', 'obrigado', 'interesse', ',', 'natalie', ',', 'ainda', 'sendo', 'recrutados', 'voluntários', 'estudo', 'clínico', 'butanvac', '.', 'pesquisa', 'sobre', 'nova', 'vacina', 'butantan', 'contra', 'covid-19', 'ainda', 'autorizada', 'anvisa', '.', 'conte', 'conosco', 'nessa', '#', 'lutapelavida', '!', '😉', '#', 'equipebutantan']",0.1467008797653958,0.4307184750733139,31.0
613,2021-03-26,113750.0,115416.0,113305.0,114781.0,114781.0,8659500,0.009063736263736244,butantanoficial,"@naderduds Agradecemos pelo interesse, @naderduds! Ainda não estão sendo recrutados voluntários para o estudo clínico da Butanvac. A pesquisa sobre a nova vacina do Butantan contra Covid-19 ainda não foi autorizada pela Agência Nacional de Vigilância Sanitária (Anvisa). (+)","@naderduds agradecemos pelo interesse, @naderduds! ainda não estão sendo recrutados voluntários para o estudo clínico da butanvac. a pesquisa sobre a nova vacina do butantan contra covid-19 ainda não foi autorizada pela agência nacional de vigilância sanitária (anvisa). (+)","@naderduds agradecemos  interesse, @naderduds! ainda   sendo recrutados voluntários   estudo clínico  butanvac.  pesquisa sobre  nova vacina  butantan contra covid-19 ainda   autorizada  agência nacional  vigilância sanitária (anvisa). (+)",0.1931818181818181,0.3272727272727273,Positivo,"['@', 'naderduds', 'agradecemos', 'interesse', ',', '@', 'naderduds', '!', 'ainda', 'sendo', 'recrutados', 'voluntários', 'estudo', 'clínico', 'butanvac', '.', 'pesquisa', 'sobre', 'nova', 'vacina', 'butantan', 'contra', 'covid-19', 'ainda', 'autorizada', 'agência', 'nacional', 'vigilância', 'sanitária', '(', 'anvisa', ')', '.', '(', '+', ')']","['@', 'naderduds', 'agradecemos', 'interesse', ',', '@', 'naderduds', '!', 'ainda', 'sendo', 'recrutados', 'voluntários', 'estudo', 'clínico', 'butanvac', '.', 'pesquisa', 'sobre', 'nova', 'vacina', 'butantan', 'contra', 'covid-19', 'ainda', 'autorizada', 'agência', 'nacional', 'vigilância', 'sanitária', '(', 'anvisa', ')', '.', '(', '+', ')']",0.1467008797653958,0.4307184750733139,31.0
614,2021-03-26,113750.0,115416.0,113305.0,114781.0,114781.0,8659500,0.009063736263736244,butantanoficial,"@rodrigobordinon Agradecemos pelo interesse, Rodrigo! Ainda não estão sendo recrutados voluntários para o estudo clínico da Butanvac. A pesquisa sobre a nova vacina do Butantan contra Covid-19 ainda não foi autorizada pela Agência Nacional de Vigilância Sanitária (Anvisa). (+)","@rodrigobordinon agradecemos pelo interesse, rodrigo! ainda não estão sendo recrutados voluntários para o estudo clínico da butanvac. a pesquisa sobre a nova vacina do butantan contra covid-19 ainda não foi autorizada pela agência nacional de vigilância sanitária (anvisa). (+)","@rodrigobordinon agradecemos  interesse, rodrigo! ainda   sendo recrutados voluntários   estudo clínico  butanvac.  pesquisa sobre  nova vacina  butantan contra covid-19 ainda   autorizada  agência nacional  vigilância sanitária (anvisa). (+)",0.1931818181818181,0.3272727272727273,Positivo,"['@', 'rodrigobordinon', 'agradecemos', 'interesse', ',', 'rodrigo', '!', 'ainda', 'sendo', 'recrutados', 'voluntários', 'estudo', 'clínico', 'butanvac', '.', 'pesquisa', 'sobre', 'nova', 'vacina', 'butantan', 'contra', 'covid-19', 'ainda', 'autorizada', 'agência', 'nacional', 'vigilância', 'sanitária', '(', 'anvisa', ')', '.', '(', '+', ')']","['@', 'rodrigobordinon', 'agradecemos', 'interesse', ',', 'rodrigo', '!', 'ainda', 'sendo', 'recrutados', 'voluntários', 'estudo', 'clínico', 'butanvac', '.', 'pesquisa', 'sobre', 'nova', 'vacina', 'butantan', 'contra', 'covid-19', 'ainda', 'autorizada', 'agência', 'nacional', 'vigilância', 'sanitária', '(', 'anvisa', ')', '.', '(', '+', ')']",0.1467008797653958,0.4307184750733139,31.0
615,2021-03-26,113750.0,115416.0,113305.0,114781.0,114781.0,8659500,0.009063736263736244,butantanoficial,"@DirceuLima18 Obrigado pelo interesse, Dirceu! Ainda não estão sendo recrutados voluntários para o estudo clínico da Butanvac. A pesquisa sobre a nova vacina do Butantan contra Covid-19 ainda não foi autorizada pela Agência Nacional de Vigilância Sanitária (Anvisa). (+)","@dirceulima18 obrigado pelo interesse, dirceu! ainda não estão sendo recrutados voluntários para o estudo clínico da butanvac. a pesquisa sobre a nova vacina do butantan contra covid-19 ainda não foi autorizada pela agência nacional de vigilância sanitária (anvisa). (+)","@dirceulima18 obrigado  interesse, dirceu! ainda   sendo recrutados voluntários   estudo clínico  butanvac.  pesquisa sobre  nova vacina  butantan contra covid-19 ainda   autorizada  agência nacional  vigilância sanitária (anvisa). (+)",0.1363636363636363,0.4545454545454545,Positivo,"['@', 'dirceulima18', 'obrigado', 'interesse', ',', 'dirceu', '!', 'ainda', 'sendo', 'recrutados', 'voluntários', 'estudo', 'clínico', 'butanvac', '.', 'pesquisa', 'sobre', 'nova', 'vacina', 'butantan', 'contra', 'covid-19', 'ainda', 'autorizada', 'agência', 'nacional', 'vigilância', 'sanitária', '(', 'anvisa', ')', '.', '(', '+', ')']","['@', 'dirceulima18', 'obrigado', 'interesse', ',', 'dirceu', '!', 'ainda', 'sendo', 'recrutados', 'voluntários', 'estudo', 'clínico', 'butanvac', '.', 'pesquisa', 'sobre', 'nova', 'vacina', 'butantan', 'contra', 'covid-19', 'ainda', 'autorizada', 'agência', 'nacional', 'vigilância', 'sanitária', '(', 'anvisa', ')', '.', '(', '+', ')']",0.1467008797653958,0.4307184750733139,31.0
616,2021-03-26,113750.0,115416.0,113305.0,114781.0,114781.0,8659500,0.009063736263736244,butantanoficial,"@Futemachine Agradecemos o seu interesse, @Futemachine, mas ainda não estão sendo recrutados voluntários para o estudo clínico da Butanvac. A pesquisa sobre a nova vacina do Butantan contra Covid-19 ainda não foi autorizada pela Agência Nacional de Vigilância Sanitária (Anvisa). (+)","@futemachine agradecemos o seu interesse, @futemachine, mas ainda não estão sendo recrutados voluntários para o estudo clínico da butanvac. a pesquisa sobre a nova vacina do butantan contra covid-19 ainda não foi autorizada pela agência nacional de vigilância sanitária (anvisa). (+)","@futemachine agradecemos   interesse, @futemachine,  ainda   sendo recrutados voluntários   estudo clínico  butanvac.  pesquisa sobre  nova vacina  butantan contra covid-19 ainda   autorizada  agência nacional  vigilância sanitária (anvisa). (+)",0.1363636363636363,0.4545454545454545,Positivo,"['@', 'futemachine', 'agradecemos', 'interesse', ',', '@', 'futemachine', ',', 'ainda', 'sendo', 'recrutados', 'voluntários', 'estudo', 'clínico', 'butanvac', '.', 'pesquisa', 'sobre', 'nova', 'vacina', 'butantan', 'contra', 'covid-19', 'ainda', 'autorizada', 'agência', 'nacional', 'vigilância', 'sanitária', '(', 'anvisa', ')', '.', '(', '+', ')']","['@', 'futemachine', 'agradecemos', 'interesse', ',', '@', 'futemachine', ',', 'ainda', 'sendo', 'recrutados', 'voluntários', 'estudo', 'clínico', 'butanvac', '.', 'pesquisa', 'sobre', 'nova', 'vacina', 'butantan', 'contra', 'covid-19', 'ainda', 'autorizada', 'agência', 'nacional', 'vigilância', 'sanitária', '(', 'anvisa', ')', '.', '(', '+', ')']",0.1482575757575757,0.4417424242424242,30.0
617,2021-03-26,113750.0,115416.0,113305.0,114781.0,114781.0,8659500,0.009063736263736244,butantanoficial,"@MelgacoRafaela Agradecemos o seu interesse, Rafaela, mas ainda não estão sendo recrutados voluntários para o estudo clínico da Butanvac. A pesquisa sobre a nova vacina do Butantan contra Covid-19 ainda não foi autorizada pela Agência Nacional de Vigilância Sanitária (Anvisa). (+)","@melgacorafaela agradecemos o seu interesse, rafaela, mas ainda não estão sendo recrutados voluntários para o estudo clínico da butanvac. a pesquisa sobre a nova vacina do butantan contra covid-19 ainda não foi autorizada pela agência nacional de vigilância sanitária (anvisa). (+)","@melgacorafaela agradecemos   interesse, rafaela,  ainda   sendo recrutados voluntários   estudo clínico  butanvac.  pesquisa sobre  nova vacina  butantan contra covid-19 ainda   autorizada  agência nacional  vigilância sanitária (anvisa). (+)",0.1363636363636363,0.4545454545454545,Positivo,"['@', 'melgacorafaela', 'agradecemos', 'interesse', ',', 'rafaela', ',', 'ainda', 'sendo', 'recrutados', 'voluntários', 'estudo', 'clínico', 'butanvac', '.', 'pesquisa', 'sobre', 'nova', 'vacina', 'butantan', 'contra', 'covid-19', 'ainda', 'autorizada', 'agência', 'nacional', 'vigilância', 'sanitária', '(', 'anvisa', ')', '.', '(', '+', ')']","['@', 'melgacorafaela', 'agradecemos', 'interesse', ',', 'rafaela', ',', 'ainda', 'sendo', 'recrutados', 'voluntários', 'estudo', 'clínico', 'butanvac', '.', 'pesquisa', 'sobre', 'nova', 'vacina', 'butantan', 'contra', 'covid-19', 'ainda', 'autorizada', 'agência', 'nacional', 'vigilância', 'sanitária', '(', 'anvisa', ')', '.', '(', '+', ')']",0.1482575757575757,0.4417424242424242,30.0
618,2021-03-26,113750.0,115416.0,113305.0,114781.0,114781.0,8659500,0.009063736263736244,butantanoficial,"@GuilhermeDilli Isso não é verdade, Guilherme. Ainda não estão sendo recrutados voluntários para o estudo clínico da Butanvac. A pesquisa sobre a nova vacina do Butantan contra Covid-19 ainda não foi autorizada pela Agência Nacional de Vigilância Sanitária (Anvisa). #EquipeButantan","@guilhermedilli isso não é verdade, guilherme. ainda não estão sendo recrutados voluntários para o estudo clínico da butanvac. a pesquisa sobre a nova vacina do butantan contra covid-19 ainda não foi autorizada pela agência nacional de vigilância sanitária (anvisa). #equipebutantan","@guilhermedilli    verdade, guilherme. ainda   sendo recrutados voluntários   estudo clínico  butanvac.  pesquisa sobre  nova vacina  butantan contra covid-19 ainda   autorizada  agência nacional  vigilância sanitária (anvisa). #equipebutantan",0.2431818181818181,0.5522727272727272,Positivo,"['@', 'guilhermedilli', 'verdade', ',', 'guilherme', '.', 'ainda', 'sendo', 'recrutados', 'voluntários', 'estudo', 'clínico', 'butanvac', '.', 'pesquisa', 'sobre', 'nova', 'vacina', 'butantan', 'contra', 'covid-19', 'ainda', 'autorizada', 'agência', 'nacional', 'vigilância', 'sanitária', '(', 'anvisa', ')', '.', '#', 'equipebutantan']","['@', 'guilhermedilli', 'verdade', ',', 'guilherme', '.', 'ainda', 'sendo', 'recrutados', 'voluntários', 'estudo', 'clínico', 'butanvac', '.', 'pesquisa', 'sobre', 'nova', 'vacina', 'butantan', 'contra', 'covid-19', 'ainda', 'autorizada', 'agência', 'nacional', 'vigilância', 'sanitária', '(', 'anvisa', ')', '.', '#', 'equipebutantan']",0.1482575757575757,0.4417424242424242,30.0
619,2021-03-26,113750.0,115416.0,113305.0,114781.0,114781.0,8659500,0.009063736263736244,butantanoficial,"@direitafree Obrigado pelo interesse, @direitafree! Ainda não estão sendo recrutados voluntários para o estudo clínico da Butanvac. A pesquisa sobre a nova vacina do Butantan contra Covid-19 ainda não foi autorizada pela Agência Nacional de Vigilância Sanitária (Anvisa). (+)","@direitafree obrigado pelo interesse, @direitafree! ainda não estão sendo recrutados voluntários para o estudo clínico da butanvac. a pesquisa sobre a nova vacina do butantan contra covid-19 ainda não foi autorizada pela agência nacional de vigilância sanitária (anvisa). (+)","@direitafree obrigado  interesse, @direitafree! ainda   sendo recrutados voluntários   estudo clínico  butanvac.  pesquisa sobre  nova vacina  butantan contra covid-19 ainda   autorizada  agência nacional  vigilância sanitária (anvisa). (+)",0.1363636363636363,0.4545454545454545,Positivo,"['@', 'direitafree', 'obrigado', 'interesse', ',', '@', 'direitafree', '!', 'ainda', 'sendo', 'recrutados', 'voluntários', 'estudo', 'clínico', 'butanvac', '.', 'pesquisa', 'sobre', 'nova', 'vacina', 'butantan', 'contra', 'covid-19', 'ainda', 'autorizada', 'agência', 'nacional', 'vigilância', 'sanitária', '(', 'anvisa', ')', '.', '(', '+', ')']","['@', 'direitafree', 'obrigado', 'interesse', ',', '@', 'direitafree', '!', 'ainda', 'sendo', 'recrutados', 'voluntários', 'estudo', 'clínico', 'butanvac', '.', 'pesquisa', 'sobre', 'nova', 'vacina', 'butantan', 'contra', 'covid-19', 'ainda', 'autorizada', 'agência', 'nacional', 'vigilância', 'sanitária', '(', 'anvisa', ')', '.', '(', '+', ')']",0.1482575757575757,0.4417424242424242,30.0
620,2021-03-26,113750.0,115416.0,113305.0,114781.0,114781.0,8659500,0.009063736263736244,butantanoficial,"@jpedrosguedes Agradecemos o seu interesse, João, mas ainda não estão sendo recrutados voluntários para o estudo clínico da Butanvac. A pesquisa sobre a nova vacina do Butantan contra Covid-19 ainda não foi autorizada pela Agência Nacional de Vigilância Sanitária (Anvisa). (+)","@jpedrosguedes agradecemos o seu interesse, joão, mas ainda não estão sendo recrutados voluntários para o estudo clínico da butanvac. a pesquisa sobre a nova vacina do butantan contra covid-19 ainda não foi autorizada pela agência nacional de vigilância sanitária (anvisa). (+)","@jpedrosguedes agradecemos   interesse, joão,  ainda   sendo recrutados voluntários   estudo clínico  butanvac.  pesquisa sobre  nova vacina  butantan contra covid-19 ainda   autorizada  agência nacional  vigilância sanitária (anvisa). (+)",0.1363636363636363,0.4545454545454545,Positivo,"['@', 'jpedrosguedes', 'agradecemos', 'interesse', ',', 'joão', ',', 'ainda', 'sendo', 'recrutados', 'voluntários', 'estudo', 'clínico', 'butanvac', '.', 'pesquisa', 'sobre', 'nova', 'vacina', 'butantan', 'contra', 'covid-19', 'ainda', 'autorizada', 'agência', 'nacional', 'vigilância', 'sanitária', '(', 'anvisa', ')', '.', '(', '+', ')']","['@', 'jpedrosguedes', 'agradecemos', 'interesse', ',', 'joão', ',', 'ainda', 'sendo', 'recrutados', 'voluntários', 'estudo', 'clínico', 'butanvac', '.', 'pesquisa', 'sobre', 'nova', 'vacina', 'butantan', 'contra', 'covid-19', 'ainda', 'autorizada', 'agência', 'nacional', 'vigilância', 'sanitária', '(', 'anvisa', ')', '.', '(', '+', ')']",0.1482575757575757,0.4417424242424242,30.0
621,2021-03-26,113750.0,115416.0,113305.0,114781.0,114781.0,8659500,0.009063736263736244,butantanoficial,"@DirceuLima18 Obrigado pelo interesse, Dirceu! Ainda não estão sendo recrutados voluntários para o estudo clínico da Butanvac. A pesquisa sobre a nova vacina do Butantan contra Covid-19 ainda não foi autorizada pela Agência Nacional de Vigilância Sanitária (Anvisa). (+)","@dirceulima18 obrigado pelo interesse, dirceu! ainda não estão sendo recrutados voluntários para o estudo clínico da butanvac. a pesquisa sobre a nova vacina do butantan contra covid-19 ainda não foi autorizada pela agência nacional de vigilância sanitária (anvisa). (+)","@dirceulima18 obrigado  interesse, dirceu! ainda   sendo recrutados voluntários   estudo clínico  butanvac.  pesquisa sobre  nova vacina  butantan contra covid-19 ainda   autorizada  agência nacional  vigilância sanitária (anvisa). (+)",0.1363636363636363,0.4545454545454545,Positivo,"['@', 'dirceulima18', 'obrigado', 'interesse', ',', 'dirceu', '!', 'ainda', 'sendo', 'recrutados', 'voluntários', 'estudo', 'clínico', 'butanvac', '.', 'pesquisa', 'sobre', 'nova', 'vacina', 'butantan', 'contra', 'covid-19', 'ainda', 'autorizada', 'agência', 'nacional', 'vigilância', 'sanitária', '(', 'anvisa', ')', '.', '(', '+', ')']","['@', 'dirceulima18', 'obrigado', 'interesse', ',', 'dirceu', '!', 'ainda', 'sendo', 'recrutados', 'voluntários', 'estudo', 'clínico', 'butanvac', '.', 'pesquisa', 'sobre', 'nova', 'vacina', 'butantan', 'contra', 'covid-19', 'ainda', 'autorizada', 'agência', 'nacional', 'vigilância', 'sanitária', '(', 'anvisa', ')', '.', '(', '+', ')']",0.1482575757575757,0.4417424242424242,30.0
622,2021-03-26,113750.0,115416.0,113305.0,114781.0,114781.0,8659500,0.009063736263736244,butantanoficial,"@naderduds Agradecemos pelo interesse, @naderduds! Ainda não estão sendo recrutados voluntários para o estudo clínico da Butanvac. A pesquisa sobre a nova vacina do Butantan contra Covid-19 ainda não foi autorizada pela Agência Nacional de Vigilância Sanitária (Anvisa). (+)","@naderduds agradecemos pelo interesse, @naderduds! ainda não estão sendo recrutados voluntários para o estudo clínico da butanvac. a pesquisa sobre a nova vacina do butantan contra covid-19 ainda não foi autorizada pela agência nacional de vigilância sanitária (anvisa). (+)","@naderduds agradecemos  interesse, @naderduds! ainda   sendo recrutados voluntários   estudo clínico  butanvac.  pesquisa sobre  nova vacina  butantan contra covid-19 ainda   autorizada  agência nacional  vigilância sanitária (anvisa). (+)",0.1931818181818181,0.3272727272727272,Positivo,"['@', 'naderduds', 'agradecemos', 'interesse', ',', '@', 'naderduds', '!', 'ainda', 'sendo', 'recrutados', 'voluntários', 'estudo', 'clínico', 'butanvac', '.', 'pesquisa', 'sobre', 'nova', 'vacina', 'butantan', 'contra', 'covid-19', 'ainda', 'autorizada', 'agência', 'nacional', 'vigilância', 'sanitária', '(', 'anvisa', ')', '.', '(', '+', ')']","['@', 'naderduds', 'agradecemos', 'interesse', ',', '@', 'naderduds', '!', 'ainda', 'sendo', 'recrutados', 'voluntários', 'estudo', 'clínico', 'butanvac', '.', 'pesquisa', 'sobre', 'nova', 'vacina', 'butantan', 'contra', 'covid-19', 'ainda', 'autorizada', 'agência', 'nacional', 'vigilância', 'sanitária', '(', 'anvisa', ')', '.', '(', '+', ')']",0.1482575757575757,0.4417424242424242,30.0
623,2021-03-26,113750.0,115416.0,113305.0,114781.0,114781.0,8659500,0.009063736263736244,butantanoficial,"@PorraHarryJudd Grato por seu interesse, @PorraHarryJudd! Ainda não estão sendo recrutados voluntários para o estudo clínico da Butanvac. A pesquisa sobre a nova vacina do Butantan contra Covid-19 ainda não foi autorizada pela Agência Nacional de Vigilância Sanitária (Anvisa). (+)","@porraharryjudd grato por seu interesse, @porraharryjudd! ainda não estão sendo recrutados voluntários para o estudo clínico da butanvac. a pesquisa sobre a nova vacina do butantan contra covid-19 ainda não foi autorizada pela agência nacional de vigilância sanitária (anvisa). (+)","@porraharryjudd grato   interesse, @porraharryjudd! ainda   sendo recrutados voluntários   estudo clínico  butanvac.  pesquisa sobre  nova vacina  butantan contra covid-19 ainda   autorizada  agência nacional  vigilância sanitária (anvisa). (+)",0.1363636363636363,0.4545454545454545,Positivo,"['@', 'porraharryjudd', 'grato', 'interesse', ',', '@', 'porraharryjudd', '!', 'ainda', 'sendo', 'recrutados', 'voluntários', 'estudo', 'clínico', 'butanvac', '.', 'pesquisa', 'sobre', 'nova', 'vacina', 'butantan', 'contra', 'covid-19', 'ainda', 'autorizada', 'agência', 'nacional', 'vigilância', 'sanitária', '(', 'anvisa', ')', '.', '(', '+', ')']","['@', 'porraharryjudd', 'grato', 'interesse', ',', '@', 'porraharryjudd', '!', 'ainda', 'sendo', 'recrutados', 'voluntários', 'estudo', 'clínico', 'butanvac', '.', 'pesquisa', 'sobre', 'nova', 'vacina', 'butantan', 'contra', 'covid-19', 'ainda', 'autorizada', 'agência', 'nacional', 'vigilância', 'sanitária', '(', 'anvisa', ')', '.', '(', '+', ')']",0.1482575757575757,0.4417424242424242,30.0
624,2021-03-26,113750.0,115416.0,113305.0,114781.0,114781.0,8659500,0.009063736263736244,butantanoficial,"@rodrigobordinon Agradecemos pelo interesse, Rodrigo! Ainda não estão sendo recrutados voluntários para o estudo clínico da Butanvac. A pesquisa sobre a nova vacina do Butantan contra Covid-19 ainda não foi autorizada pela Agência Nacional de Vigilância Sanitária (Anvisa). (+)","@rodrigobordinon agradecemos pelo interesse, rodrigo! ainda não estão sendo recrutados voluntários para o estudo clínico da butanvac. a pesquisa sobre a nova vacina do butantan contra covid-19 ainda não foi autorizada pela agência nacional de vigilância sanitária (anvisa). (+)","@rodrigobordinon agradecemos  interesse, rodrigo! ainda   sendo recrutados voluntários   estudo clínico  butanvac.  pesquisa sobre  nova vacina  butantan contra covid-19 ainda   autorizada  agência nacional  vigilância sanitária (anvisa). (+)",0.1931818181818181,0.3272727272727272,Positivo,"['@', 'rodrigobordinon', 'agradecemos', 'interesse', ',', 'rodrigo', '!', 'ainda', 'sendo', 'recrutados', 'voluntários', 'estudo', 'clínico', 'butanvac', '.', 'pesquisa', 'sobre', 'nova', 'vacina', 'butantan', 'contra', 'covid-19', 'ainda', 'autorizada', 'agência', 'nacional', 'vigilância', 'sanitária', '(', 'anvisa', ')', '.', '(', '+', ')']","['@', 'rodrigobordinon', 'agradecemos', 'interesse', ',', 'rodrigo', '!', 'ainda', 'sendo', 'recrutados', 'voluntários', 'estudo', 'clínico', 'butanvac', '.', 'pesquisa', 'sobre', 'nova', 'vacina', 'butantan', 'contra', 'covid-19', 'ainda', 'autorizada', 'agência', 'nacional', 'vigilância', 'sanitária', '(', 'anvisa', ')', '.', '(', '+', ')']",0.1482575757575757,0.4417424242424242,30.0
625,2021-03-26,113750.0,115416.0,113305.0,114781.0,114781.0,8659500,0.009063736263736244,butantanoficial,"@ElaineM95146035 Agradecemos o seu interesse, Elaine, mas ainda não estão sendo recrutados voluntários para o estudo clínico da Butanvac. A pesquisa sobre a nova vacina do Butantan contra Covid-19 ainda não foi autorizada pela Agência Nacional de Vigilância Sanitária (Anvisa). (+)","@elainem95146035 agradecemos o seu interesse, elaine, mas ainda não estão sendo recrutados voluntários para o estudo clínico da butanvac. a pesquisa sobre a nova vacina do butantan contra covid-19 ainda não foi autorizada pela agência nacional de vigilância sanitária (anvisa). (+)","@elainem95146035 agradecemos   interesse, elaine,  ainda   sendo recrutados voluntários   estudo clínico  butanvac.  pesquisa sobre  nova vacina  butantan contra covid-19 ainda   autorizada  agência nacional  vigilância sanitária (anvisa). (+)",0.1363636363636363,0.4545454545454545,Positivo,"['@', 'elainem95146035', 'agradecemos', 'interesse', ',', 'elaine', ',', 'ainda', 'sendo', 'recrutados', 'voluntários', 'estudo', 'clínico', 'butanvac', '.', 'pesquisa', 'sobre', 'nova', 'vacina', 'butantan', 'contra', 'covid-19', 'ainda', 'autorizada', 'agência', 'nacional', 'vigilância', 'sanitária', '(', 'anvisa', ')', '.', '(', '+', ')']","['@', 'elainem95146035', 'agradecemos', 'interesse', ',', 'elaine', ',', 'ainda', 'sendo', 'recrutados', 'voluntários', 'estudo', 'clínico', 'butanvac', '.', 'pesquisa', 'sobre', 'nova', 'vacina', 'butantan', 'contra', 'covid-19', 'ainda', 'autorizada', 'agência', 'nacional', 'vigilância', 'sanitária', '(', 'anvisa', ')', '.', '(', '+', ')']",0.1482575757575757,0.4417424242424242,30.0
